{
  "id": null,
  "quantity": 98443395,
  "unitPrice": 15680819.753759414,
  "code": "Excepteur reprehenderit velit culpa",
  "auditInfo": {
    "isDeleted": true,
    "createdBy": "sint nulla",
    "updatedBy": "irure ut dolore fugiat Duis",
    "updatedDate": null,
    "createdDate": "1970-08-16T15:28:08.389Z"
  },
  "name": "magna"
}
